{
  "schemaVersion": "1.0.0",
  "messageType": "eventBatch",
  "runId": "golden-run-08",
  "scenarioId": "incident-override",
  "epochId": 1,
  "simTimeMs": 1000,
  "payload": {
    "events": [
      {
        "eventSeq": 1,
        "eventType": "incidentOpened",
        "payload": {
          "fixtureIntent": "incident-override"
        }
      }
    ]
  }
}
