{
  "schemaVersion": "1.0.0",
  "messageType": "eventBatch",
  "runId": "golden-run-06",
  "scenarioId": "vehicle-switch-quota",
  "epochId": 1,
  "simTimeMs": 1000,
  "payload": {
    "events": [
      {
        "eventSeq": 1,
        "eventType": "bookingConfirmed",
        "payload": {
          "requestId": "r-06"
        }
      }
    ]
  }
}
