{
  "schemaVersion": "1.0.0",
  "messageType": "eventBatch",
  "runId": "golden-run-01",
  "scenarioId": "one-vehicle-one-request-accept",
  "epochId": 1,
  "simTimeMs": 1000,
  "payload": {
    "events": [
      {
        "eventSeq": 1,
        "eventType": "requestArrived",
        "payload": {
          "request": {
            "requestId": "r-01",
            "arrivalTimeMs": 1000,
            "originNodeId": "n-1",
            "destinationNodeId": "n-2",
            "earliestPickupMs": 1000,
            "latestPickupMs": 2000,
            "maxRideTimeMs": 2000,
            "partySize": 1,
            "serviceClass": "standard",
            "commitmentPolicyId": "uniform-v1"
          }
        }
      }
    ]
  }
}
